[
  {
    "paperid": "",
    "expname": "",
    "content": "",
    "eeg": {
      "recording reference": "",
      "analysis reference": "",
      "sampling rate": 0,
      "final low pass": 0,
      "final high pass": 0,
      "epoch rejection": "",
      "mean rejected": 0,
      "sites nomenclature": "",
      "sites": [
        "",
        ""
      ],
      "sites 5%": [
        "",
        ""
      ],
      "baseline": "",
      "epoch": "",
      "hardware": "",
      "active electrodes": false
    },
    "subjects": [
      {
        "groupname": "",
        "n": -1,
        "mean age": -1,
        "age range": "",
        "num of females": -1,
        "language(s) spoken": "",
        "description": ""
      }
    ],
    "procedure": {
      "language": "",
      "modality": "visual",
      "task": "",
      "lists": "",
      "word duration": 0,
      "woa": "",
      "conditions": [
        {
          "condname": "",
          "cp": "",
          "items": 0,
          "description": "",
          "example": "",
          "wp": ""
        }
      ]
    },
    "data": [
      {
        "condition": "",
        "subjects": "",
        "time": "",
        "figure": "",
        "figuredoi": "",
        "page": "",
        "color": "",
        "type": ""
      }
    ]
  }
]
